{
  "$schema": "./schemas/registry-provider.schema.json",
  "provider": "shopify",
  "vaultSecrets": {
    "SHOPIFY_ACCESS_TOKEN": "secret"
  },
  "auth": {
    "header": {
      "header_name": "X-Shopify-Access-Token",
      "value_template": "{{secret}}"
    }
  },
  "hosts": [
    "myshopify.com"
  ],
  "capabilities": [
    {
      "id": "shopify/admin",
      "provider": "shopify",
      "allow": {
        "hosts": [
          "myshopify.com"
        ],
        "methods": [
          "DELETE",
          "GET",
          "POST",
          "PUT"
        ],
        "pathPrefixes": [
          "/admin/api/"
        ]
      }
    }
  ]
}
