{
  "$schema": "./schemas/registry-provider.schema.json",
  "provider": "xero",
  "vaultSecrets": {
    "XERO_TOKEN": "secret"
  },
  "auth": {
    "header": {
      "header_name": "authorization",
      "value_template": "Bearer {{secret}}"
    }
  },
  "hosts": [
    "api.xero.com"
  ],
  "capabilities": [
    {
      "id": "xero/accounting",
      "provider": "xero",
      "allow": {
        "hosts": [
          "api.xero.com"
        ],
        "methods": [
          "DELETE",
          "GET",
          "POST",
          "PUT"
        ],
        "pathPrefixes": [
          "/api.xro/2.0/"
        ]
      }
    }
  ]
}
