{
  "$schema": "./schemas/registry-provider.schema.json",
  "provider": "google-places",
  "vaultSecrets": {
    "GOOGLE_PLACES_API_KEY": "secret"
  },
  "auth": {
    "header": {
      "header_name": "x-goog-api-key",
      "value_template": "{{secret}}"
    }
  },
  "hosts": [
    "places.googleapis.com"
  ],
  "capabilities": [
    {
      "id": "google-places/autocomplete",
      "provider": "google-places",
      "allow": {
        "hosts": [
          "places.googleapis.com"
        ],
        "methods": [
          "POST"
        ],
        "pathPrefixes": [
          "/v1/places:autocomplete"
        ]
      }
    },
    {
      "id": "google-places/details",
      "provider": "google-places",
      "allow": {
        "hosts": [
          "places.googleapis.com"
        ],
        "methods": [
          "GET"
        ],
        "pathPrefixes": [
          "/v1/places"
        ]
      }
    },
    {
      "id": "google-places/search-text",
      "provider": "google-places",
      "allow": {
        "hosts": [
          "places.googleapis.com"
        ],
        "methods": [
          "POST"
        ],
        "pathPrefixes": [
          "/v1/places:searchText"
        ]
      }
    }
  ]
}
