{
  "$schema": "./schemas/registry-provider.schema.json",
  "provider": "anthropic",
  "vaultSecrets": {
    "ANTHROPIC_API_KEY": "secret"
  },
  "auth": {
    "header": {
      "header_name": "x-api-key",
      "value_template": "{{secret}}"
    }
  },
  "hosts": [
    "api.anthropic.com"
  ],
  "capabilities": [
    {
      "id": "anthropic/messages",
      "provider": "anthropic",
      "allow": {
        "hosts": [
          "api.anthropic.com"
        ],
        "methods": [
          "GET",
          "POST"
        ],
        "pathPrefixes": [
          "/v1/messages"
        ]
      }
    },
    {
      "id": "anthropic/models",
      "provider": "anthropic",
      "allow": {
        "hosts": [
          "api.anthropic.com"
        ],
        "methods": [
          "GET"
        ],
        "pathPrefixes": [
          "/v1/models"
        ]
      }
    }
  ]
}
