{
  "$schema": "./schemas/registry-provider.schema.json",
  "provider": "openai",
  "vaultSecrets": {
    "OPENAI_API_KEY": "secret"
  },
  "auth": {
    "header": {
      "header_name": "authorization",
      "value_template": "Bearer {{secret}}"
    }
  },
  "hosts": [
    "api.openai.com"
  ],
  "credentialAlternatives": [
    {
      "id": "codex-oauth",
      "vaultSecrets": {
        "CODEX_OAUTH_JSON": "oauth"
      },
      "auth": {
        "multi_header": [
          {
            "header_name": "authorization",
            "value_template": "Bearer {{access_token}}"
          },
          {
            "header_name": "ChatGPT-Account-Id",
            "value_template": "{{account_id}}"
          }
        ]
      },
      "hosts": [
        "chatgpt.com"
      ],
      "capabilities": [
        "openai/codex-responses"
      ],
      "priority": 100,
      "upstreamPathPrefix": "/backend-api/codex"
    },
    {
      "id": "codex-oauth-usage",
      "vaultSecrets": {
        "CODEX_OAUTH_JSON": "oauth"
      },
      "auth": {
        "multi_header": [
          {
            "header_name": "authorization",
            "value_template": "Bearer {{access_token}}"
          },
          {
            "header_name": "ChatGPT-Account-Id",
            "value_template": "{{account_id}}"
          }
        ]
      },
      "hosts": [
        "chatgpt.com"
      ],
      "capabilities": [
        "openai/codex-usage"
      ],
      "priority": 100,
      "upstreamPathPrefix": "/backend-api"
    }
  ],
  "capabilities": [
    {
      "id": "openai/assistants",
      "provider": "openai",
      "allow": {
        "hosts": [
          "api.openai.com"
        ],
        "methods": [
          "DELETE",
          "GET",
          "POST"
        ],
        "pathPrefixes": [
          "/v1/assistants",
          "/v1/threads"
        ]
      }
    },
    {
      "id": "openai/batch",
      "provider": "openai",
      "allow": {
        "hosts": [
          "api.openai.com"
        ],
        "methods": [
          "GET",
          "POST"
        ],
        "pathPrefixes": [
          "/v1/batches"
        ]
      }
    },
    {
      "id": "openai/chat-completions",
      "provider": "openai",
      "allow": {
        "hosts": [
          "api.openai.com"
        ],
        "methods": [
          "GET",
          "POST"
        ],
        "pathPrefixes": [
          "/v1/chat/completions"
        ]
      }
    },
    {
      "id": "openai/codex-responses",
      "provider": "openai",
      "allow": {
        "hosts": [
          "chatgpt.com"
        ],
        "methods": [
          "POST"
        ],
        "pathPrefixes": [
          "/responses"
        ]
      }
    },
    {
      "id": "openai/codex-usage",
      "provider": "openai",
      "allow": {
        "hosts": [
          "chatgpt.com"
        ],
        "methods": [
          "GET"
        ],
        "pathPrefixes": [
          "/wham/usage"
        ]
      }
    },
    {
      "id": "openai/embeddings",
      "provider": "openai",
      "allow": {
        "hosts": [
          "api.openai.com"
        ],
        "methods": [
          "POST"
        ],
        "pathPrefixes": [
          "/v1/embeddings"
        ]
      }
    },
    {
      "id": "openai/files",
      "provider": "openai",
      "allow": {
        "hosts": [
          "api.openai.com"
        ],
        "methods": [
          "DELETE",
          "GET",
          "POST"
        ],
        "pathPrefixes": [
          "/v1/files"
        ]
      }
    },
    {
      "id": "openai/fine-tuning",
      "provider": "openai",
      "allow": {
        "hosts": [
          "api.openai.com"
        ],
        "methods": [
          "DELETE",
          "GET",
          "POST"
        ],
        "pathPrefixes": [
          "/v1/fine_tuning"
        ]
      }
    },
    {
      "id": "openai/image-generation",
      "provider": "openai",
      "allow": {
        "hosts": [
          "api.openai.com"
        ],
        "methods": [
          "POST"
        ],
        "pathPrefixes": [
          "/v1/images"
        ]
      }
    },
    {
      "id": "openai/models",
      "provider": "openai",
      "allow": {
        "hosts": [
          "api.openai.com"
        ],
        "methods": [
          "DELETE",
          "GET"
        ],
        "pathPrefixes": [
          "/v1/models"
        ]
      }
    },
    {
      "id": "openai/moderation",
      "provider": "openai",
      "allow": {
        "hosts": [
          "api.openai.com"
        ],
        "methods": [
          "POST"
        ],
        "pathPrefixes": [
          "/v1/moderations"
        ]
      }
    },
    {
      "id": "openai/realtime",
      "provider": "openai",
      "allow": {
        "hosts": [
          "api.openai.com"
        ],
        "methods": [
          "GET",
          "POST"
        ],
        "pathPrefixes": [
          "/v1/realtime"
        ]
      }
    },
    {
      "id": "openai/responses",
      "provider": "openai",
      "allow": {
        "hosts": [
          "api.openai.com"
        ],
        "methods": [
          "DELETE",
          "GET",
          "POST"
        ],
        "pathPrefixes": [
          "/v1/responses"
        ]
      }
    },
    {
      "id": "openai/speech",
      "provider": "openai",
      "allow": {
        "hosts": [
          "api.openai.com"
        ],
        "methods": [
          "POST"
        ],
        "pathPrefixes": [
          "/v1/audio/speech"
        ]
      }
    },
    {
      "id": "openai/transcription",
      "provider": "openai",
      "allow": {
        "hosts": [
          "api.openai.com"
        ],
        "methods": [
          "POST"
        ],
        "pathPrefixes": [
          "/v1/audio/transcriptions"
        ]
      }
    },
    {
      "id": "openai/translation",
      "provider": "openai",
      "allow": {
        "hosts": [
          "api.openai.com"
        ],
        "methods": [
          "POST"
        ],
        "pathPrefixes": [
          "/v1/audio/translations"
        ]
      }
    },
    {
      "id": "openai/uploads",
      "provider": "openai",
      "allow": {
        "hosts": [
          "api.openai.com"
        ],
        "methods": [
          "POST"
        ],
        "pathPrefixes": [
          "/v1/uploads"
        ]
      }
    },
    {
      "id": "openai/vector-stores",
      "provider": "openai",
      "allow": {
        "hosts": [
          "api.openai.com"
        ],
        "methods": [
          "DELETE",
          "GET",
          "POST"
        ],
        "pathPrefixes": [
          "/v1/vector_stores"
        ]
      }
    },
    {
      "id": "openai/videos",
      "provider": "openai",
      "allow": {
        "hosts": [
          "api.openai.com"
        ],
        "methods": [
          "DELETE",
          "GET",
          "POST"
        ],
        "pathPrefixes": [
          "/v1/videos"
        ]
      }
    }
  ]
}
