{
  "$schema": "./schemas/registry-provider.schema.json",
  "provider": "elevenlabs",
  "vaultSecrets": {
    "ELEVENLABS_API_KEY": "secret"
  },
  "auth": {
    "header": {
      "header_name": "xi-api-key",
      "value_template": "{{secret}}"
    }
  },
  "hosts": [
    "api.elevenlabs.io"
  ],
  "capabilities": [
    {
      "id": "elevenlabs/audio-isolation",
      "provider": "elevenlabs",
      "allow": {
        "hosts": [
          "api.elevenlabs.io"
        ],
        "methods": [
          "POST"
        ],
        "pathPrefixes": [
          "/v1/audio-isolation"
        ]
      }
    },
    {
      "id": "elevenlabs/audio-native",
      "provider": "elevenlabs",
      "allow": {
        "hosts": [
          "api.elevenlabs.io"
        ],
        "methods": [
          "GET",
          "POST"
        ],
        "pathPrefixes": [
          "/v1/audio-native"
        ]
      }
    },
    {
      "id": "elevenlabs/conversational-ai",
      "provider": "elevenlabs",
      "allow": {
        "hosts": [
          "api.elevenlabs.io"
        ],
        "methods": [
          "DELETE",
          "GET",
          "PATCH",
          "POST"
        ],
        "pathPrefixes": [
          "/v1/convai"
        ]
      }
    },
    {
      "id": "elevenlabs/dubbing",
      "provider": "elevenlabs",
      "allow": {
        "hosts": [
          "api.elevenlabs.io"
        ],
        "methods": [
          "DELETE",
          "GET",
          "POST"
        ],
        "pathPrefixes": [
          "/v1/dubbing"
        ]
      }
    },
    {
      "id": "elevenlabs/forced-alignment",
      "provider": "elevenlabs",
      "allow": {
        "hosts": [
          "api.elevenlabs.io"
        ],
        "methods": [
          "POST"
        ],
        "pathPrefixes": [
          "/v1/forced-alignment"
        ]
      }
    },
    {
      "id": "elevenlabs/history",
      "provider": "elevenlabs",
      "allow": {
        "hosts": [
          "api.elevenlabs.io"
        ],
        "methods": [
          "DELETE",
          "GET",
          "POST"
        ],
        "pathPrefixes": [
          "/v1/history"
        ]
      }
    },
    {
      "id": "elevenlabs/models",
      "provider": "elevenlabs",
      "allow": {
        "hosts": [
          "api.elevenlabs.io"
        ],
        "methods": [
          "GET"
        ],
        "pathPrefixes": [
          "/v1/models"
        ]
      }
    },
    {
      "id": "elevenlabs/pronunciation-dictionaries",
      "provider": "elevenlabs",
      "allow": {
        "hosts": [
          "api.elevenlabs.io"
        ],
        "methods": [
          "DELETE",
          "GET",
          "POST"
        ],
        "pathPrefixes": [
          "/v1/pronunciation-dictionaries"
        ]
      }
    },
    {
      "id": "elevenlabs/sound-effects",
      "provider": "elevenlabs",
      "allow": {
        "hosts": [
          "api.elevenlabs.io"
        ],
        "methods": [
          "POST"
        ],
        "pathPrefixes": [
          "/v1/sound-generation"
        ]
      }
    },
    {
      "id": "elevenlabs/studio",
      "provider": "elevenlabs",
      "allow": {
        "hosts": [
          "api.elevenlabs.io"
        ],
        "methods": [
          "DELETE",
          "GET",
          "POST"
        ],
        "pathPrefixes": [
          "/v1/projects"
        ]
      }
    },
    {
      "id": "elevenlabs/text-to-dialogue",
      "provider": "elevenlabs",
      "allow": {
        "hosts": [
          "api.elevenlabs.io"
        ],
        "methods": [
          "POST"
        ],
        "pathPrefixes": [
          "/v1/text-to-dialogue"
        ]
      }
    },
    {
      "id": "elevenlabs/text-to-speech",
      "provider": "elevenlabs",
      "allow": {
        "hosts": [
          "api.elevenlabs.io"
        ],
        "methods": [
          "POST"
        ],
        "pathPrefixes": [
          "/v1/text-to-speech"
        ]
      }
    },
    {
      "id": "elevenlabs/transcription",
      "provider": "elevenlabs",
      "allow": {
        "hosts": [
          "api.elevenlabs.io"
        ],
        "methods": [
          "POST"
        ],
        "pathPrefixes": [
          "/v1/speech-to-text"
        ]
      }
    },
    {
      "id": "elevenlabs/voice-changer",
      "provider": "elevenlabs",
      "allow": {
        "hosts": [
          "api.elevenlabs.io"
        ],
        "methods": [
          "POST"
        ],
        "pathPrefixes": [
          "/v1/speech-to-speech"
        ]
      }
    },
    {
      "id": "elevenlabs/voice-design",
      "provider": "elevenlabs",
      "allow": {
        "hosts": [
          "api.elevenlabs.io"
        ],
        "methods": [
          "POST"
        ],
        "pathPrefixes": [
          "/v1/text-to-voice",
          "/v1/voice-generation"
        ]
      }
    },
    {
      "id": "elevenlabs/voices",
      "provider": "elevenlabs",
      "allow": {
        "hosts": [
          "api.elevenlabs.io"
        ],
        "methods": [
          "DELETE",
          "GET",
          "POST"
        ],
        "pathPrefixes": [
          "/v1/voices",
          "/v2/voices"
        ]
      }
    }
  ]
}
